1,1,920,37320,In,euismod,tempor erat neque non quam. Pellentesque habitant morbi tristique senectus et netus et,vehicula,85418,risus.,2012-08-16,2020-08-16,1,1
2,1,34475,32189,sodales,nascetur,"tellus. Suspendisse sed dolor. Fusce mi lorem,","ac,",70857,sodales,2018-08-10,2020-11-29,2,2
3,0,38728,19519,eu,"augue,",dignissim lacus. Aliquam rutrum lorem,dapibus,33810,Duis,2018-01-16,2020-11-15,3,3
4,1,19007,38639,"lobortis,",neque.,fermentum convallis ligula. Donec luctus aliquet odio.,Proin,34070,tincidunt,2016-12-11,2021-02-24,4,4
5,1,39809,8537,libero.,ad,"Aliquam nisl. Nulla eu neque pellentesque massa lobortis ultrices. Vivamus rhoncus. Donec est. Nunc ullamcorper, velit in aliquet",erat,26919,auctor.,2016-11-03,2020-10-13,5,5
6,1,19339,606,"auctor,",Mauris,Donec egestas. Duis ac arcu. Nunc mauris. Morbi non sapien molestie orci,Cum,33827,pharetra,2019-06-10,2020-08-12,6,6
7,1,15454,47229,tristique,pretium,"eu neque pellentesque massa lobortis ultrices. Vivamus rhoncus. Donec est. Nunc ullamcorper, velit",nunc,46494,egestas,2013-01-11,2020-10-28,7,7
8,1,10069,22927,massa.,at,"libero. Morbi accumsan laoreet ipsum. Curabitur consequat, lectus sit amet luctus vulputate, nisi sem","ornare,",97394,Quisque,2006-01-19,2021-01-17,8,8
9,1,14229,15100,amet,fermentum,sit amet ante.,Phasellus,95951,ante,2018-12-08,2020-08-19,9,9
10,1,18632,18727,Suspendisse,"eget,",rutrum lorem ac risus. Morbi metus. Vivamus euismod,libero.,15248,Integer,2008-03-05,2021-04-07,10,10
11,0,37170,44346,diam.,Duis,"lorem, luctus ut, pellentesque eget, dictum placerat, augue. Sed molestie. Sed id risus quis diam luctus lobortis. Class aptent",odio,45416,sociis,2007-09-20,2021-03-16,11,11
12,0,4406,33704,Aenean,Proin,eros. Nam consequat dolor vitae dolor. Donec fringilla. Donec feugiat metus sit amet ante. Vivamus non lorem vitae,blandit.,74759,"magna,",2020-07-14,2020-10-10,12,12
13,1,11553,24398,viverra.,eget,"ante lectus convallis est, vitae sodales nisi magna sed dui. Fusce aliquam, enim nec tempus scelerisque, lorem ipsum",Integer,11956,"erat,",2021-05-17,2021-04-12,13,13
14,1,2989,12877,"sapien,",Integer,"id, libero. Donec consectetuer mauris id sapien. Cras dolor dolor, tempus non, lacinia at,",neque.,55682,"vulputate,",2015-02-25,2021-06-01,14,14
15,0,6437,46325,arcu,sit,"lorem ipsum sodales purus, in molestie tortor nibh sit amet orci. Ut sagittis lobortis mauris. Suspendisse aliquet molestie",tempor,40219,adipiscing,2011-07-18,2020-11-06,15,15
16,0,10182,21728,enim.,nulla,"elit. Aliquam auctor, velit eget laoreet posuere, enim nisl elementum purus, accumsan",nisi.,29688,"vel,",2019-05-04,2021-05-08,16,16
17,1,34965,8116,"non,",massa.,Quisque ornare tortor at risus. Nunc ac sem,"ornare,",31834,habitant,2020-09-06,2020-11-30,17,17
18,1,21032,46651,risus,nisl.,dui. Cras pellentesque. Sed dictum. Proin,mauris,62641,cursus,2008-09-19,2021-04-22,18,18
19,1,7846,48891,neque,diam,"pharetra ut, pharetra sed, hendrerit a, arcu. Sed et libero. Proin mi. Aliquam gravida mauris","sapien,",11110,nonummy.,2009-08-13,2020-08-26,19,19
20,1,28443,34291,mauris,Nunc,"Phasellus fermentum convallis ligula. Donec luctus aliquet odio. Etiam ligula tortor, dictum eu, placerat",Vestibulum,42916,Cras,2008-08-12,2020-11-12,20,20
21,1,21470,38059,euismod,posuere,Pellentesque habitant morbi tristique senectus et,mollis,95442,"aliquam,",2017-11-21,2021-04-27,21,21
22,0,8524,34435,elit,fringilla,ad litora torquent,gravida,80432,"pharetra,",2007-07-31,2020-11-28,22,22
23,1,14736,26665,elementum,Vivamus,magna et ipsum cursus vestibulum. Mauris magna. Duis,Suspendisse,11245,placerat,2008-03-02,2020-09-28,23,23
24,1,9085,26183,dui.,nisi.,"Fusce mi lorem, vehicula et, rutrum eu, ultrices sit amet, risus. Donec nibh enim, gravida sit amet, dapibus id,",et,11187,eget,2017-04-30,2020-11-28,24,24
25,0,30880,49738,velit,ligula.,"consectetuer rhoncus. Nullam velit dui, semper et, lacinia vitae, sodales","convallis,",38300,sapien.,2018-11-14,2020-09-24,25,25
26,0,37018,39530,pede.,"a,",adipiscing lacus. Ut nec,mi,79610,libero,2018-11-04,2020-12-07,26,26
27,0,34238,18661,et,ligula.,"varius et, euismod et, commodo at, libero. Morbi accumsan laoreet ipsum. Curabitur consequat, lectus sit amet",massa.,15676,arcu,2016-01-21,2021-04-27,27,27
28,0,5957,4425,auctor,odio.,"adipiscing, enim",interdum,41938,ultrices.,2011-11-09,2021-04-03,28,28
29,1,20478,3863,Donec,mi,"ligula. Nullam enim. Sed nulla ante, iaculis nec, eleifend non, dapibus rutrum, justo. Praesent luctus.",massa,63687,taciti,2008-06-22,2021-05-02,29,29
30,1,26529,40562,et,vitae,"Donec egestas. Aliquam nec enim. Nunc ut erat. Sed nunc est, mollis non, cursus non, egestas a, dui.",Sed,39345,"amet,",2012-09-04,2021-06-28,30,30
31,1,27997,23611,nulla.,Pellentesque,dapibus,nec,78601,sit,2017-04-07,2021-03-30,31,31
32,1,9296,29944,"tortor,",ullamcorper,"enim nec tempus scelerisque, lorem ipsum sodales purus, in molestie tortor nibh sit amet orci. Ut sagittis lobortis mauris.",mollis,77283,mollis.,2011-04-04,2020-09-10,32,32
33,0,700,38637,dui,"risus,","ante dictum mi, ac mattis velit justo nec ante. Maecenas mi felis, adipiscing fringilla, porttitor vulputate, posuere vulputate, lacus.",orci,25976,Integer,2020-06-23,2020-07-19,33,33
34,1,858,12318,adipiscing,varius,"dictum sapien. Aenean massa. Integer vitae nibh. Donec est mauris, rhoncus id, mollis nec, cursus a, enim. Suspendisse aliquet, sem",mauris,70559,ac,2009-08-23,2021-05-19,34,34
35,1,6665,37520,rutrum,mi,"vulputate, nisi sem semper erat, in consectetuer ipsum nunc id enim. Curabitur massa. Vestibulum accumsan neque et",gravida.,12544,lacus.,2018-01-31,2021-04-05,35,35
36,0,26959,47622,ante,Proin,Fusce fermentum fermentum arcu. Vestibulum ante ipsum primis in faucibus orci luctus et ultrices posuere,"ornare,",45543,metus,2015-09-27,2020-08-23,36,36
39,0,11933,3696,ullamcorper,scelerisque,egestas,libero.,98056,quam,2014-12-27,2020-10-08,39,39
40,0,26345,8295,laoreet,accumsan,"risus. Nunc ac sem ut dolor dapibus gravida. Aliquam tincidunt, nunc ac mattis",enim.,79517,Fusce,2014-09-26,2021-04-24,40,40
41,1,7288,47242,et,egestas.,"non, sollicitudin a, malesuada id, erat.",primis,18064,odio,2008-05-19,2021-06-03,41,41
42,1,30426,12122,"vel,",Phasellus,"Fusce mollis. Duis sit amet diam eu dolor egestas rhoncus. Proin nisl sem, consequat nec,",Sed,89289,gravida.,2021-05-04,2020-11-28,42,42
43,1,16446,780,sit,facilisis,in,eleifend.,85794,Pellentesque,2009-02-19,2021-01-11,43,43
44,1,9837,40482,hendrerit,nisi,ridiculus mus. Proin vel nisl. Quisque fringilla euismod enim. Etiam gravida molestie arcu. Sed eu nibh vulputate mauris sagittis,ligula.,24418,Duis,2006-09-19,2021-04-07,44,44
45,0,39425,9049,ultrices,vitae,orci,vestibulum,59269,Fusce,2018-05-16,2020-08-27,45,45
46,1,10270,47599,risus.,purus.,"magna. Lorem ipsum dolor sit amet, consectetuer adipiscing elit. Etiam laoreet, libero",Nulla,39625,Maecenas,2020-03-23,2020-09-03,46,46
47,0,26943,34890,Nullam,nonummy.,mauris a nunc. In at pede. Cras vulputate velit eu sem. Pellentesque ut ipsum ac mi eleifend egestas.,augue,37113,est.,2011-12-28,2020-11-07,47,47
48,0,13576,1042,sem,Phasellus,Quisque tincidunt pede ac urna. Ut,iaculis,17219,"eu,",2018-01-03,2020-11-02,48,48
49,1,2991,42576,amet,nec,primis in faucibus orci luctus,nec,65142,magna,2016-02-10,2021-05-18,49,49
50,0,16474,41860,odio,lobortis,"ante dictum mi, ac mattis velit justo nec ante. Maecenas mi felis, adipiscing","ac,",51326,enim.,2017-11-20,2020-10-01,50,50
51,1,22175,22704,velit,"aliquet,",consectetuer mauris,non,79769,malesuada,2016-03-06,2021-01-26,51,51
52,1,17644,25582,risus.,Cras,malesuada. Integer id magna et ipsum,blandit.,34152,feugiat,2008-09-14,2021-03-02,52,52
53,0,21450,34880,hendrerit,imperdiet,"sed, sapien. Nunc pulvinar arcu et",Quisque,11007,ipsum.,2012-03-24,2020-08-29,53,53
54,0,22693,41453,Nunc,lacus.,"nec enim. Nunc ut erat. Sed nunc est, mollis",tellus.,64508,auctor,2008-08-31,2020-09-15,54,54
55,1,35572,43506,dictum,fermentum,vitae,Phasellus,40157,pede.,2005-07-08,2021-01-20,55,55
56,1,10851,44940,Curabitur,Nunc,"quam, elementum at, egestas a, scelerisque sed, sapien. Nunc",ut,97931,enim.,2018-09-19,2020-07-31,56,56
57,0,6878,10878,pede.,"eu,",In nec orci. Donec nibh. Quisque nonummy ipsum non arcu. Vivamus sit,"ac,",73874,dolor,2008-08-13,2020-09-20,57,57
58,1,28938,41230,"eu,",ac,"dis parturient montes, nascetur ridiculus mus. Donec dignissim magna a tortor. Nunc commodo auctor velit. Aliquam nisl. Nulla","urna,",73958,a,2010-03-21,2020-11-17,58,58
59,1,26718,37913,aliquam,enim.,"ornare tortor at risus. Nunc ac sem ut dolor dapibus gravida. Aliquam tincidunt, nunc ac mattis",molestie,63779,euismod,2018-01-09,2021-05-07,59,59
60,0,17355,9293,magna.,Aenean,malesuada fames ac turpis egestas. Fusce aliquet magna a neque.,dui.,60616,"lorem,",2008-09-17,2021-01-16,60,60
61,0,27208,21411,a,Nulla,Nulla facilisi. Sed neque.,auctor,19594,"vel,",2016-08-27,2021-06-19,61,61
63,0,14869,49388,ligula.,ligula,"diam dictum sapien. Aenean massa. Integer vitae nibh. Donec est mauris, rhoncus id, mollis","egestas,",90271,hymenaeos.,2020-06-07,2021-02-04,63,63
64,0,14599,22982,"id,",pharetra,eu,"ut,",18529,luctus,2017-03-08,2020-09-04,64,64
65,0,23098,3175,aliquam,In,"venenatis vel, faucibus id, libero. Donec consectetuer mauris id sapien.",pretium,92729,Cras,2015-07-17,2020-09-08,65,65
66,0,37972,37177,sit,sed,Lorem ipsum,ipsum.,39916,magna,2017-03-27,2021-06-30,66,66
67,0,4832,43223,est,aliquet,"pede et risus. Quisque libero lacus, varius et, euismod et, commodo at, libero. Morbi accumsan laoreet ipsum.",libero.,37564,ac,2019-10-04,2020-11-07,67,67
68,1,14798,12835,venenatis,fringilla,"libero lacus,",sem,81347,Aliquam,2007-12-22,2020-08-09,68,68
69,1,32620,39015,purus,non,mus. Donec dignissim magna a tortor. Nunc commodo auctor,morbi,20239,"amet,",2015-11-09,2021-05-27,69,69
70,1,23918,16925,ornare,hendrerit,"vulputate, lacus. Cras interdum. Nunc sollicitudin commodo ipsum. Suspendisse non leo. Vivamus nibh dolor, nonummy",mauris,95234,Suspendisse,2008-11-19,2020-07-04,70,70
71,0,6264,6493,"at,",eu,arcu. Sed eu nibh vulputate mauris sagittis placerat. Cras dictum ultricies ligula. Nullam enim.,ac,93413,Nulla,2012-11-19,2021-04-30,71,71
72,0,32692,3984,Mauris,lorem,ac mi,a,80642,mauris,2015-12-22,2021-05-01,72,72
73,1,25652,10602,quam.,eu,aliquam adipiscing lacus.,mauris.,87492,nec,2006-10-18,2021-01-27,73,73
74,1,36891,6341,mi,gravida,lacus. Ut nec urna,"iaculis,",59137,et,2020-05-29,2020-11-29,74,74
75,1,27138,32225,molestie.,"leo,",Quisque tincidunt pede ac urna. Ut tincidunt vehicula risus.,arcu.,81122,mattis,2005-09-23,2021-01-22,75,75
76,0,31593,22405,Nullam,posuere,"tortor, dictum eu, placerat eget, venenatis a, magna. Lorem ipsum dolor sit amet, consectetuer adipiscing elit. Etiam laoreet, libero et",fames,46637,Duis,2019-12-08,2021-04-12,76,76
77,0,29451,17600,condimentum,malesuada,volutpat nunc sit amet metus. Aliquam erat volutpat. Nulla facilisis. Suspendisse commodo,enim,69270,Maecenas,2005-08-12,2021-02-02,77,77
78,1,37103,43555,magna,"vitae,",tempus mauris erat eget ipsum. Suspendisse,cursus.,96232,ultrices.,2006-10-29,2020-10-01,78,78
79,1,3179,15221,In,semper,"congue, elit sed consequat auctor, nunc nulla vulputate dui, nec tempus mauris erat eget ipsum. Suspendisse sagittis.",ac,63524,nulla,2012-12-26,2020-07-15,79,79
80,0,29973,3307,Nullam,eu,egestas rhoncus. Proin nisl,id,14149,pellentesque.,2011-05-13,2021-04-30,80,80
81,0,28065,37814,non,Mauris,orci. Ut semper pretium neque.,vel,63620,augue,2006-06-12,2021-04-22,81,81
82,0,34887,31671,ligula,sem,"nisl arcu iaculis enim, sit amet ornare lectus justo eu arcu. Morbi sit amet massa.",vitae,26559,Duis,2009-12-30,2021-04-14,82,82
83,1,26743,29841,mi,placerat,lacus.,"in,",96433,ullamcorper,2019-09-30,2020-12-06,83,83
84,0,32707,14375,eu,vulputate,odio.,egestas.,59391,Donec,2015-01-29,2020-10-07,84,84
85,1,14004,14443,pharetra,dictum,"est, congue a, aliquet vel, vulputate eu, odio. Phasellus at augue id ante dictum cursus. Nunc",malesuada,65964,"quis,",2012-07-03,2020-11-30,85,85
86,0,3803,16979,eleifend.,malesuada,"accumsan sed,","eget,",76207,"a,",2020-08-01,2020-09-17,86,86
87,0,36492,12093,"purus,",eros,"sed, sapien. Nunc pulvinar arcu et pede. Nunc sed orci lobortis augue",ultrices,69026,bibendum,2012-05-09,2021-06-19,87,87
88,0,16554,20375,parturient,Mauris,"vitae, erat.",rutrum.,98097,laoreet,2016-10-22,2021-05-14,88,88
89,0,11419,9204,"augue,",Phasellus,"auctor non, feugiat nec, diam. Duis mi enim, condimentum",in,93630,Proin,2011-06-26,2020-12-10,89,89
90,0,32346,9331,"scelerisque,",nisl,"pulvinar arcu et pede. Nunc sed orci lobortis augue scelerisque mollis. Phasellus libero mauris, aliquam eu, accumsan sed,","ante,",57567,Aliquam,2010-03-08,2021-05-07,90,90
91,1,24528,30337,condimentum,nunc,non sapien molestie orci tincidunt adipiscing.,"sapien,",42759,auctor,2011-08-05,2020-10-24,91,91
92,1,22109,1479,nec,per,"pede. Cras vulputate velit eu sem. Pellentesque ut ipsum ac mi eleifend egestas. Sed pharetra,","tincidunt,",72975,fermentum,2016-04-15,2020-09-11,92,92
93,1,37159,9013,Nam,euismod,"vitae, erat. Vivamus nisi. Mauris nulla.",lobortis,90007,ultrices,2011-08-09,2021-02-09,93,93
94,1,33841,13629,eu,risus.,"lectus pede, ultrices a, auctor non,","ac,",37056,"lorem,",2007-02-18,2021-03-05,94,94
95,0,2937,30234,nibh,metus.,Phasellus ornare. Fusce mollis. Duis sit amet,vitae,95360,"vulputate,",2008-03-15,2021-01-12,95,95
96,0,22307,39572,Nunc,Nunc,"ut aliquam iaculis,",Sed,29679,interdum,2017-10-20,2020-08-25,96,96
97,1,29014,9614,dignissim,diam.,"porttitor eros nec tellus. Nunc lectus pede, ultrices a,",Duis,30846,semper,2016-11-26,2020-07-04,97,97
98,0,3427,48298,lorem,placerat.,lorem tristique aliquet. Phasellus fermentum,dui.,74409,nisi.,2018-03-30,2020-12-01,98,98
99,1,27422,976,tincidunt,risus.,"a, enim. Suspendisse aliquet, sem ut cursus luctus, ipsum leo elementum sem, vitae aliquam eros","est,",49106,Suspendisse,2012-05-11,2021-06-08,99,99
100,1,2376,34140,auctor,dui,tellus id nunc interdum feugiat. Sed nec metus facilisis lorem tristique aliquet. Phasellus fermentum convallis,ultricies,99688,nisl.,2020-12-01,2020-11-23,100,100
